,name,artwork,poseType,sod,gRoq1_mat,gRoq2_mat,gRoq3_mat,gRoq4_mat,reasons,tempo_score,tempo,pitch_score,pitch,density_score,density,additional_perception
0,나비,A8,ballet,9,"[0, 0, 0, 0]","[0, 1, 1, 1]","[1, 1, 1, 1]","[0, 1, 0, 0]",팔다리의 큰 움직임,9.0,9,7.0,7,8.0,8,
1,rub,A8,ballet,9,"[1, 1, 1, 1]","[1, 1, 1, 1]","[1, 1, 1, 1]","[1, 1, 1, 1]","it's a really loud painting for me, can hear the trainer shouting in the ballet classroom",8.0,8 |  i can image they've repeated this for thousands,7.0,7,8.0,8 |  he ( the trainer) is mad,
2,Daisy,A8,ballet,6,"[0, 0, 0, 0]","[0, 1, 1, 1]","[1, 1, 1, 0]","[0, 1, 0, 1]","The women are dancing, but the quality of the painting (or the drawing style) makes me feel that the definition is not good enough for rating the dynamics.",6.0,6 |  I think the tempo here is the tempo of the ballet dance.,8.0,"8 |  Because there is a conductor at the bottom of the painting, I think the music is high-pitched.",7.0,7 |  Same reason with the question about the pitch.,
3,Doky,A8,ballet,8,"[0, 0, 0, 0]","[0, 0, 1, 1]","[0, 1, 0, 0]","[0, 0, 0, 0]",일단 역동적 움직임을 하는 인원이 다인원임에 따라 역동성이 극대화됨 ,7.0,7 |  단체의 움직임인만큼 비교적 빠른 음악이 어울릴 것 같음. ,4.0,4 |  뭔가 부족의 느낌이 강하기 때문에 좀 웅장하고 어두워보여 보통보다 조금 낮은 핏치가 어울림. ,9.0,9 |  부족의 음악처럼 다양한 음악적 색채로 어우러진 높은 밀도의 음악이 어울릴 것 같음. ,
4,chanpig,A8,ballet,7,"[1, 1, 1, 1]","[1, 1, 1, 1]","[1, 1, 0, 0]","[1, 1, 0, 0]",움직임도 보이고 배경에ㅜ라인이 잇어서 좀더 역동적,7.0,7 |  배경에 라인때문에 좀더 빠라보임,6.0,6 |  배경이 주는 색감때문에 엄청 높지않을듯 ,8.0,8 |  배경때문에 뭔가 급하고 긴장감이 보임,
5,곤듀,A8,ballet,5,"[0, 0, 0, 0]","[0, 1, 1, 0]","[0, 1, 1, 0]","[0, 1, 1, 0]",선택한 부분에서 두 사람이 합을 맞추어 춤을 추고 있음이 느껴짐,5.0,5 |  그림의 색감 등 전체적인 분위기가 우아한 파티를 연상캐 함,3.0,3 |  샘플상의 보통피치는 본 그림에서 느껴지는 분위기에 비해 가볍다고 생각됨. 매우 낮은 피치 또는  매우 낮은 - 보통의 사이정도의 피치가 적당할 것으로 생각함.,5.0,5 |  그림을 보자마자 우아함이 연상됨. 따라서 보통의 음의 밀도가 적합하다고 생각함.,
6,이인애,A8,ballet,7,"[0, 0, 0, 0]","[1, 1, 1, 1]","[0, 0, 0, 0]","[0, 0, 0, 0]",선 터치 강렬,7.0,7,6.0,6,4.0,4,
7,고고,A8,ballet,9,"[0, 0, 0, 1]","[1, 1, 1, 1]","[0, 1, 1, 1]","[0, 0, 0, 0]",다수가 춤추는 모습,9.0,9,9.0,9,9.0,9,
8,경,A8,ballet,10,"[0, 0, 0, 1]","[0, 0, 1, 0]","[1, 1, 1, 0]","[0, 1, 0, 0]","여러 인물의 팔, 다리의 포즈로 활동적인 움직임이 잘 드러남.",9.0,9 |  활동적인 움직임을 잘 나타냄.,7.0,"7 |  무겁지 않은 분위기, 여러 사람의 움직임을 잘 드러냄.",8.0,8 |  여러 사람의 움직임을 잘 드러냄.,
9,yoni,A8,ballet,7,"[0, 0, 0, 0]","[1, 1, 1, 1]","[1, 1, 1, 1]","[1, 1, 1, 1]",인물과 배경의 경계의 모호함 오른쪽 밑 쌩뚱맞은 손,9.0,9,8.0,8,3.0,3,
10,밍경댕,A8,ballet,6,"[0, 0, 0, 0]","[0, 0, 1, 1]","[0, 1, 1, 0]","[0, 1, 0, 1]",자세가 역동적인 자세이나 화법이 좀 차분해서 그렇게 역동적으로 안 느껴짐 또한 회초리로 인해 억지로 연습하는 느낌,3.0,3 |  화법이나 색감이 그렇게 빠른 느낌은 안 듬,4.0,4 |  어두운 발레가 생각남.,8.0,8 |  배경이 짙은 녹색이다보니 밀도가 좀 높은 음으로 구성될 것 같음.,
11,배뀽,A8,ballet,9,"[1, 1, 1, 1]","[1, 1, 1, 1]","[1, 1, 1, 0]","[1, 1, 1, 1]",춤추는 발레리나 숲의 떨림 ,8.0,8 |  지휘자의 지휘봉이 빠를 것 같음 ,9.0,9 |  빠른음으로 격렬하게 했으면 좋겠다 ,9.0,9 |  사람 많은 걸로 보아 밀도가 촘촘해야한다 ,
12,미지,A8,ballet,6,"[1, 1, 1, 1]","[1, 1, 1, 0]","[1, 0, 0, 0]","[1, 0, 0, 0]",배경의 거친표현이 역동성을 살림,4.0,4 | 질감 표현이 거칠게 느껴지고 전체적인 색채가 어두워 밝은 느낌의 빠른템포가 어울리지않음,4.0,4 | 위와 같은 이유,8.0,8 | 등장인물들의 수가 많기 때문에,
13,boldmas,A8,ballet,10,"[0, 0, 0, 0]","[0, 1, 1, 1]","[1, 1, 1, 0]","[1, 1, 0, 0]",The moving subjects of the painting and the most amount of concentrated and long brush strokes.,1.0,10 | The subjects seem to be dancing swiftly,8.0,8 | The performance seems to be very lively,1.0,10 | The performance seems to be intricate and lively and there are a multitude of people dancing,
14,Seong Ho,A8,ballet,10,"[0,1,0,0]","[1,1,1,1]","[0,1,1,0]","[0,1,0,0]",단체로 춤을 추는 모습. 붓 터치감이 매우 역동적으로 느껴짐.,10.0,  매우 빠른 느낌의 음악이 필요해 보임.,3.0,  전통춤이라 적당히 낮았으면 함.,10.0,  빽빽한 느낌 표현 원함.,짙은 푸른색이 주는 자연미.
15,5e67524094c67a000a04ca8e,A8,ballet,7,"[0,1,1,0]","[0,1,1,0]","[0,1,1,1]","[0,0,1,1]",Very dynamic but very hard to understand,10.0,,10.0,,10.0,,
16,6400dc9af341e8a575a457f6,A8,ballet,7,"[0,0,0,0]","[0,0,1,1]","[1,1,1,0]","[0,1,0,0]",indicates movement,8.0,,10.0,,10.0,,
17,5e4875f3110b3730eefa32a1,A8,ballet,1,"[0,0,0,0]","[0,0,0,0]","[0,0,0,0]","[0,0,0,1]",the striking stick,3.0,,8.0,,4.0,,
18,5e909d9ac9ce2503b2650797,A8,ballet,6,"[0,0,0,1]","[0,0,1,1]","[0,1,1,0]","[0,1,0,0]",line of dancers give a lot of movement,9.0,,8.0,,5.0,,
19,5fc00a11268eb941e7d8b066,A8,ballet,4,"[0,0,0,0]","[0,0,0,0]","[0,0,0,0]","[0,0,0,1]",The hand is most pronounced.,9.0,,8.0,,2.0,,
20,5b295f60bbd4880001117976,A8,ballet,7,"[0,0,0,1]","[0,0,1,1]","[0,1,1,0]","[0,1,0,0]",,7.0,,7.0,,7.0,,
21,630100561dc47fd83f5b4745,A8,ballet,7,"[0,0,1,1]","[0,0,1,1]","[1,1,0,0]","[0,1,0,0]",Movement from the arms and legs. ,5.0,,5.0,,5.0,,
22,5f7959d0b6791155e6932dd1,A8,ballet,4,"[0,0,0,0]","[0,0,1,1]","[0,1,0,1]","[0,0,0,1]",The contrast between the lightness of the ballet dancers and the prominent dark baton held in the bottom corner is what brings the dynamism. ,4.0,  A middling tempo should be had like the the slow smooth movements of the ballet dancers.,4.0,  The pitch should be moderate to low as you might have in the intro of a ballet show.,4.0,  The lightness should be like the apparent ease you get when watching a ballet dancer perform. Like it is all easy for them.,"There should also be a sense of solidity in the music, like a dramatic beat that comes in to show the forcefulness of the the hand holding the baton."
23,5967e9a831394d0001abdb3f,A8,ballet,6,"[0,0,0,0]","[0,0,0,0]","[0,1,0,0]","[0,1,0,0]","The ballerina is dancing away, creating a sense of dynamism",2.0,  Slow dancing music,4.0,,1.0,,
24,657421f9661ce9a8cd7482d1,A8,ballet,8,"[0,0,0,0]","[0,1,1,1]","[0,1,1,1]","[0,1,1,0]",The sense of dynamic is unique with respect to the background area.,5.0,  Moderate tempo music is good for the art work ,5.0,  Moderate pitch music is good for the art work ,5.0,  Moderate density music is good for the art work ,
25,5e56590389b924000c184113,A8,ballet,9,"[0,0,0,0]","[0,1,1,1]","[1,1,1,0]","[0,1,0,1]","Light, movement, vitality, energy",10.0,,7.0,,9.0,,Brush strokes add movement. Colour palette too has such breadth.
26,65c4bfbc22bc351322c66e32,A8,ballet,6,"[0,0,0,0]","[0,0,1,0]","[0,0,0,0]","[0,0,0,0]",A little more beautiful,3.0,,2.0,,5.0,,
27,63f77942d3cad20e65a411a9,A8,ballet,9,"[1,1,1,1]","[1,1,1,1]","[1,1,1,1]","[1,1,1,1]",the whole image is in motion,8.0,,8.0,,8.0,,
28,5c584d2040378900013b6fb9,A8,ballet,7,"[0,0,0,0]","[0,0,1,1]","[1,1,1,0]","[1,1,0,1]",you can see a wand which is being held and pointed at a fairy type figure. she looks to be made a different size,7.0,,7.0,,8.0,,
29,613e454dca2db9fcef1f8e8d,A8,ballet,8,"[0,1,1,0]","[1,0,1,1]","[0,1,1,0]","[0,1,0,1]","The movement of arms and legs dancing, and the lines in the abstract backgound that also indicate movement. A blurryness to the image. The movement of the conductors baton",8.0,,7.0,,8.0,"  It feels like there is a lot going on in this image, the density of the green colour is quite intense",
