respondent_id,collector_id,date_created,date_modified,ip_address,email_address,first_name,last_name,custom_1,"Explanation and ConsentBefore starting the survey, please read this guideline and explanation document carefully. If you are willing to participate, please mark two checkboxes below.",,Your Prolific ID,Year of Birth (4 digits),Sex,How much do you enjoy seeing artworks?,How often do you appreciate art in your life?,How dynamic do you think this painting is (based on your visual perception)?Please answer this before hearing any sound files.,"How well does each music file harmonize with the given painting in general?(Attention Check: If you hear 'rain sounds' 🌧️💦, mark it as ""3"".)  https://surveymonkey-assets.s3.amazonaws.com/survey/414377538/rte/0045ce0b-f5e7-4d2e-82df-8130533a6158.jpg",,,,,"How well does each music file reflect the sense of dynamics of this painting?(Attention Check: If you hear 'rain sounds' 🌧️💦, mark it as ""3"".) https://surveymonkey-assets.s3.amazonaws.com/survey/414377538/rte/48106240-b165-43f6-afef-5924db5adb25.jpg",,,,,"Evaluate the quality of each music itself (sound organization / sound aesthetics). (Attention Check: If you hear 'rain sounds' 🌧️💦, mark it as ""3"".) https://surveymonkey-assets.s3.amazonaws.com/survey/414377538/rte/bf523e6a-1c3e-445b-9fbd-203bf6af986c.jpg",,,,,How dynamic do you think this painting is (based on your visual perception)?Please answer this before hearing any sound files.,"How well does each music file harmonize with the given painting in general?(Attention Check: If you hear 'rain sounds' 🌧️💦, mark it as ""3"".)  https://surveymonkey-assets.s3.amazonaws.com/survey/414377538/rte/52e49ac4-4b39-4ed5-95f3-ec071172c130.jpg",,,,,"How well does each music file reflect the sense of dynamics of this painting?(Attention Check: If you hear 'rain sounds' 🌧️💦, mark it as ""3"".) https://surveymonkey-assets.s3.amazonaws.com/survey/414377538/rte/bb7ba734-6764-42c5-bd85-88c4df8b919f.jpg",,,,,"Evaluate the quality of each music itself (sound organization / sound aesthetics). (Attention Check: If you hear 'rain sounds' 🌧️💦, mark it as ""3"".) https://surveymonkey-assets.s3.amazonaws.com/survey/414377538/rte/74bd9818-acce-4759-9438-9deea1f4c0d9.jpg",,,,,How dynamic do you think this painting is (based on your visual perception)?Please answer this before hearing any sound files.,"How well does each music file harmonize with the given painting in general?(Attention Check: If you hear 'rain sounds' 🌧️💦, mark it as ""3"".)  https://surveymonkey-assets.s3.amazonaws.com/survey/414377538/rte/ac59f705-dc79-495d-b7e9-14bb361c3e41.jpg",,,,,"How well does each music file reflect the sense of dynamics of this painting?(Attention Check: If you hear 'rain sounds' 🌧️💦, mark it as ""3"".) https://surveymonkey-assets.s3.amazonaws.com/survey/414377538/rte/5161bc7f-ac1d-498a-bbb7-f8e4bab5330a.jpg",,,,,"Evaluate the quality of each music itself (sound organization / sound aesthetics). (Attention Check: If you hear 'rain sounds' 🌧️💦, mark it as ""3"".) https://surveymonkey-assets.s3.amazonaws.com/survey/414377538/rte/0301dbf8-7553-41f7-b5c2-8acd89150294.jpg",,,,,How dynamic do you think this painting is (based on your visual perception)?Please answer this before hearing any sound files.,"How well does each music file harmonize with the given painting in general?(Attention Check: If you hear 'rain sounds' 🌧️💦, mark it as ""3"".)  https://surveymonkey-assets.s3.amazonaws.com/survey/414377538/rte/da0590af-b943-406b-815b-b44dc2b1e021.jpg",,,,,"How well does each music file reflect the sense of dynamics of this painting?(Attention Check: If you hear 'rain sounds' 🌧️💦, mark it as ""3"".) https://surveymonkey-assets.s3.amazonaws.com/survey/414377538/rte/e71ea9cf-d609-464c-9578-5d5dd1158308.jpg",,,,,"Evaluate the quality of each music itself (sound organization / sound aesthetics). (Attention Check: If you hear 'rain sounds' 🌧️💦, mark it as ""3"".) https://surveymonkey-assets.s3.amazonaws.com/survey/414377538/rte/56797e6c-4e1a-489e-bec2-e281f0a72953.jpg",,,,,How dynamic do you think this painting is (based on your visual perception)?Please answer this before hearing any sound files.,"How well does each music file harmonize with the given painting in general?(Attention Check: If you hear 'rain sounds' 🌧️💦, mark it as ""3"".)  https://surveymonkey-assets.s3.amazonaws.com/survey/414377538/rte/14f43cbb-9a08-460c-ac18-c834362ba2e1.jpg",,,,,"How well does each music file reflect the sense of dynamics of this painting?(Attention Check: If you hear 'rain sounds' 🌧️💦, mark it as ""3"".) https://surveymonkey-assets.s3.amazonaws.com/survey/414377538/rte/f3bad161-f6a3-4260-a04a-4e332e4fcfc1.jpg",,,,,"Evaluate the quality of each music itself (sound organization / sound aesthetics). (Attention Check: If you hear 'rain sounds' 🌧️💦, mark it as ""3"".) https://surveymonkey-assets.s3.amazonaws.com/survey/414377538/rte/b286abec-a470-4e25-b9a2-8ba8192f035c.jpg",,,,,How dynamic do you think this painting is (based on your visual perception)?Please answer this before hearing any sound files.,"How well does each music file harmonize with the given painting in general?(Attention Check: If you hear 'rain sounds' 🌧️💦, mark it as ""3"".)  https://surveymonkey-assets.s3.amazonaws.com/survey/414377538/rte/09828d51-0a34-49c9-b1c3-bdb1d8155712.jpg",,,,,"How well does each music file reflect the sense of dynamics of this painting?(Attention Check: If you hear 'rain sounds' 🌧️💦, mark it as ""3"".) https://surveymonkey-assets.s3.amazonaws.com/survey/414377538/rte/df319053-4a52-469f-9e81-d4773fc857b0.jpg",,,,,"Evaluate the quality of each music itself (sound organization / sound aesthetics). (Attention Check: If you hear 'rain sounds' 🌧️💦, mark it as ""3"".) https://surveymonkey-assets.s3.amazonaws.com/survey/414377538/rte/3c305571-48be-4723-9a75-970455d696e5.jpg",,,,,How dynamic do you think this painting is (based on your visual perception)?Please answer this before hearing any sound files.,"How well does each music file harmonize with the given painting in general?(Attention Check: If you hear 'rain sounds' 🌧️💦, mark it as ""3"".)  https://surveymonkey-assets.s3.amazonaws.com/survey/414377538/rte/e86f00f3-ba84-4b2e-8dcb-536e7496edcc.jpg",,,,,"How well does each music file reflect the sense of dynamics of this painting?(Attention Check: If you hear 'rain sounds' 🌧️💦, mark it as ""3"".) https://surveymonkey-assets.s3.amazonaws.com/survey/414377538/rte/380f62b0-da20-4bcd-b009-bbe85d4ed1d7.jpg",,,,,"Evaluate the quality of each music itself (sound organization / sound aesthetics). (Attention Check: If you hear 'rain sounds' 🌧️💦, mark it as ""3"".) https://surveymonkey-assets.s3.amazonaws.com/survey/414377538/rte/2419ca96-0501-459a-8482-26df889467b3.jpg",,,,,How dynamic do you think this painting is (based on your visual perception)?Please answer this before hearing any sound files.,"How well does each music file harmonize with the given painting in general?(Attention Check: If you hear 'rain sounds' 🌧️💦, mark it as ""3"".)  https://surveymonkey-assets.s3.amazonaws.com/survey/414377538/rte/7acce5de-5d72-4900-8375-9d033c6364cd.jpg",,,,,"How well does each music file reflect the sense of dynamics of this painting?(Attention Check: If you hear 'rain sounds' 🌧️💦, mark it as ""3"".) https://surveymonkey-assets.s3.amazonaws.com/survey/414377538/rte/bde72f36-73e6-48e3-b8a2-cf0ed92a9300.jpg",,,,,"Evaluate the quality of each music itself (sound organization / sound aesthetics). (Attention Check: If you hear 'rain sounds' 🌧️💦, mark it as ""3"".) https://surveymonkey-assets.s3.amazonaws.com/survey/414377538/rte/67c11cdf-d087-4cf0-9913-a193ed12cc7f.jpg",,,,,How dynamic do you think this painting is (based on your visual perception)?Please answer this before hearing any sound files.,"How well does each music file harmonize with the given painting in general?(Attention Check: If you hear 'rain sounds' 🌧️💦, mark it as ""3"".)  https://surveymonkey-assets.s3.amazonaws.com/survey/414377538/rte/978e7267-9aef-4cdc-9266-085a53183683.jpg",,,,,"How well does each music file reflect the sense of dynamics of this painting?(Attention Check: If you hear 'rain sounds' 🌧️💦, mark it as ""3"".) https://surveymonkey-assets.s3.amazonaws.com/survey/414377538/rte/68bcd315-4fe1-4553-a2fa-a4ca5a6ca4b5.jpg",,,,,"Evaluate the quality of each music itself (sound organization / sound aesthetics). (Attention Check: If you hear 'rain sounds' 🌧️💦, mark it as ""3"".) https://surveymonkey-assets.s3.amazonaws.com/survey/414377538/rte/da5fff48-10e4-4e2c-a6cb-cf76d342b5a8.jpg",,,,,How dynamic do you think this painting is (based on your visual perception)?Please answer this before hearing any sound files.,"How well does each music file harmonize with the given painting in general?(Attention Check: If you hear 'rain sounds' 🌧️💦, mark it as ""3"".)  https://surveymonkey-assets.s3.amazonaws.com/survey/414377538/rte/f0e56c35-079b-468f-9fca-ff0e74cceed9.jpg",,,,,"How well does each music file reflect the sense of dynamics of this painting?(Attention Check: If you hear 'rain sounds' 🌧️💦, mark it as ""3"".) https://surveymonkey-assets.s3.amazonaws.com/survey/414377538/rte/ef1ba3ee-98fc-457a-8ce6-0ef945b21c75.jpg",,,,,"Evaluate the quality of each music itself (sound organization / sound aesthetics). (Attention Check: If you hear 'rain sounds' 🌧️💦, mark it as ""3"".) https://surveymonkey-assets.s3.amazonaws.com/survey/414377538/rte/8beb017f-2ef6-4ec5-95ca-a96feb6e6a6d.jpg",,,,,How dynamic do you think this painting is (based on your visual perception)?Please answer this before hearing any sound files.,"How well does each music file harmonize with the given painting in general?(Attention Check: If you hear 'rain sounds' 🌧️💦, mark it as ""3"".)  https://surveymonkey-assets.s3.amazonaws.com/survey/414377538/rte/0c14c09c-8c9d-45c8-8956-bf6640d3183a.jpg",,,,,"How well does each music file reflect the sense of dynamics of this painting?(Attention Check: If you hear 'rain sounds' 🌧️💦, mark it as ""3"".) https://surveymonkey-assets.s3.amazonaws.com/survey/414377538/rte/aa77d733-9a8e-48c1-9c2a-1826758ea478.jpg",,,,,"Evaluate the quality of each music itself (sound organization / sound aesthetics). (Attention Check: If you hear 'rain sounds' 🌧️💦, mark it as ""3"".) https://surveymonkey-assets.s3.amazonaws.com/survey/414377538/rte/dcd09f66-404d-4b71-9558-ecb2a2d112a5.jpg",,,,,How dynamic do you think this painting is (based on your visual perception)?Please answer this before hearing any sound files.,"How well does each music file harmonize with the given painting in general?(Attention Check: If you hear 'rain sounds' 🌧️💦, mark it as ""3"".)  https://surveymonkey-assets.s3.amazonaws.com/survey/414377538/rte/a9cecee1-52d1-416e-9b69-c4aac8f2ecfa.jpg",,,,,"How well does each music file reflect the sense of dynamics of this painting?(Attention Check: If you hear 'rain sounds' 🌧️💦, mark it as ""3"".) https://surveymonkey-assets.s3.amazonaws.com/survey/414377538/rte/ee4759cc-615d-4352-9bfa-2001ecdb81f0.jpg",,,,,"Evaluate the quality of each music itself (sound organization / sound aesthetics). (Attention Check: If you hear 'rain sounds' 🌧️💦, mark it as ""3"".) https://surveymonkey-assets.s3.amazonaws.com/survey/414377538/rte/072927c0-9cca-4181-b899-91f011d7da4b.jpg",,,,,PERFORMANCE.How successful were you in terms of appreciating paintings (in this no-music setup)?,SENSE OF DYNAMICS.How well were you able to perceive the sense of dynamics of the painting (in this no-music setup)?,EMPATHETIC.How well were you able to perceive empathy with the characters in the painting (in conjunction with the generated music)?,ENJOYMENT.How enjoyable was it to appreciate art (in this no-music setup)?,CONCENTRATION.How well were you able to concentrate on your art appreciation (in this no-music setup)?,,PERFORMANCE.How successful were you in terms of appreciating paintings (in conjunction with the generated music)?,,SENSE OF DYNAMICS.How well were you able to perceive the sense of dynamics of the painting (in conjunction with the generated music)?,,EMPATHETIC.How well were you able to perceive empathy with the characters in the painting (in conjunction with the generated music)?,,ENJOYMENT.How enjoyable was it to appreciate art (in conjunction with the generated music)?,,CONCENTRATION.How well were you able to concentrate on your art appreciation (in conjunction with the generated music)?,,
,,,,,,,,,"Hereby I mark this box, I confirm that I read the research guideline and explanation document, understood the purpose of this study, and am willing to participate in this survey.",I understand that I can freely withdraw my participation during the course of the research.,Open-Ended Response,Open-Ended Response,Response,Response,Response,Response,Sound A,Sound B,Sound C,Sound D,Any Comments to describe your response? (optional),Sound A,Sound B,Sound C,Sound D,Any Comments to describe your response? (optional),Sound A,Sound B,Sound C,Sound D,Any Comments to describe your response? (optional),Response,Sound A,Sound B,Sound C,Sound D,Any Comments to describe your response? (optional),Sound A,Sound B,Sound C,Sound D,Any Comments to describe your response? (optional),Sound A,Sound B,Sound C,Sound D,Any Comments to describe your response? (optional),Response,Sound A,Sound B,Sound C,Sound D,Any Comments to describe your response? (optional),Sound A,Sound B,Sound C,Sound D,Any Comments to describe your response? (optional),Sound A,Sound B,Sound C,Sound D,Any Comments to describe your response? (optional),Response,Sound A,Sound B,Sound C,Sound D,Any Comments to describe your response? (optional),Sound A,Sound B,Sound C,Sound D,Any Comments to describe your response? (optional),Sound A,Sound B,Sound C,Sound D,Any Comments to describe your response? (optional),Response,Sound A,Sound B,Sound C,Sound D,Any Comments to describe your response? (optional),Sound A,Sound B,Sound C,Sound D,Any Comments to describe your response? (optional),Sound A,Sound B,Sound C,Sound D,Any Comments to describe your response? (optional),Response,Sound A,Sound B,Sound C,Sound D,Any Comments to describe your response? (optional),Sound A,Sound B,Sound C,Sound D,Any Comments to describe your response? (optional),Sound A,Sound B,Sound C,Sound D,Any Comments to describe your response? (optional),Response,Sound A,Sound B,Sound C,Sound D,Any Comments to describe your response? (optional),Sound A,Sound B,Sound C,Sound D,Any Comments to describe your response? (optional),Sound A,Sound B,Sound C,Sound D,Any Comments to describe your response? (optional),Response,Sound A,Sound B,Sound C,Sound D,Any Comments to describe your response? (optional),Sound A,Sound B,Sound C,Sound D,Any Comments to describe your response? (optional),Sound A,Sound B,Sound C,Sound D,Any Comments to describe your response? (optional),Response,Sound A,Sound B,Sound C,Sound D,Any Comments to describe your response? (optional),Sound A,Sound B,Sound C,Sound D,Any Comments to describe your response? (optional),Sound A,Sound B,Sound C,Sound D,Any Comments to describe your response? (optional),Response,Sound A,Sound B,Sound C,Sound D,Any Comments to describe your response? (optional),Sound A,Sound B,Sound C,Sound D,Any Comments to describe your response? (optional),Sound A,Sound B,Sound C,Sound D,Any Comments to describe your response? (optional),Response,Sound A,Sound B,Sound C,Sound D,Any Comments to describe your response? (optional),Sound A,Sound B,Sound C,Sound D,Any Comments to describe your response? (optional),Sound A,Sound B,Sound C,Sound D,Any Comments to describe your response? (optional),Response,Sound A,Sound B,Sound C,Sound D,Any Comments to describe your response? (optional),Sound A,Sound B,Sound C,Sound D,Any Comments to describe your response? (optional),Sound A,Sound B,Sound C,Sound D,Any Comments to describe your response? (optional),Response,Response,Response,Response,Response,Any Comments to describe your response? (optional),Response,Any Comments to describe your response? (optional),Response,Any Comments to describe your response? (optional),Response,Any Comments to describe your response? (optional),Response,Any Comments to describe your response? (optional),Response,Any Comments to describe your response? (optional),
1.1467E+11,432305548,2024-08-26 22:02:44,2024-08-26 23:39:18,31.205.103.111,,,,,1,2,1,2003,2,4,4,4,5,3,2,2,,5,3,3,2,,5,3,1,1,,2,1,2,3,4,,4,1,3,4,,1,1,3,4,,4,5,3,2,3,,5,5,2,3,,4,1,2,3,,1,2,4,1,3,,3,4,1,3,,2,5,1,3,,4,2,4,3,1,,2,4,3,1,,1,4,3,1,,4,3,3,4,1,,2,3,2,1,,2,3,5,1,,3,3,3,5,1,,3,3,5,1,,2,3,4,1,,5,1,5,3,2,,1,5,3,2,,1,5,3,1,,5,5,1,3,2,,5,2,3,2,,4,2,3,1,,2,2,1,4,3,,3,1,5,3,,2,2,4,3,,3,5,2,2,3,,4,3,2,3,,4,3,1,3,,3,4,3,5,1,,3,3,4,1,,2,3,5,2,,4,3,3,3,3,,4,,4,,5,,5,,3,,
1.1467E+11,432305548,2024-08-26 21:55:46,2024-08-26 23:26:04,45.194.101.216,,,,,1,2,2,1995,2,4,5,5,5,3,1,1,,5,3,1,1,,5,3,1,1,,2,2,1,3,5,,1,1,3,4,,2,1,3,5,,4,5,2,2,3,,5,3,2,3,,5,1,1,3,,2,3,5,2,3,,4,5,2,3,,1,4,2,3,,4,2,5,3,2,,2,5,3,2,,2,4,3,3,,4,2,3,5,1,,2,3,5,1,,2,3,5,2,,2,2,3,4,1,,3,3,5,1,,1,3,3,2,,4,2,5,3,2,,2,5,3,2,,2,1,3,1,,5,4,2,3,1,,5,2,3,1,,5,1,3,1,,2,1,2,5,3,,3,1,5,3,,1,1,5,3,,3,5,1,1,3,,5,3,2,3,,5,1,1,3,,2,1,3,5,2,,2,3,5,2,,1,3,5,1,,4,4,2,3,4,,5,,4,,5,,5,,4,,
1.1467E+11,432305548,2024-08-26 21:56:44,2024-08-26 23:04:48,90.214.238.254,,,,,1,2,3,1994,1,3,3,4,5,3,1,1,,5,3,1,1,,4,3,2,2,,1,2,1,3,4,,1,1,3,1,,1,1,3,4,,3,4,2,1,3,,4,2,1,3,,5,1,2,3,,1,3,4,2,3,,4,5,4,3,,1,4,2,3,,4,2,4,3,1,,2,4,3,1,,2,4,3,2,,5,2,3,4,2,,2,3,4,1,,1,3,4,1,,1,2,3,4,2,,4,3,5,2,,2,3,4,1,,3,2,4,3,2,,1,5,3,2,,3,5,3,3,,4,5,2,3,2,,5,2,3,1,,5,1,3,2,,1,2,2,5,3,,3,1,4,3,,2,1,5,3,,1,4,2,2,3,,5,4,2,3,,4,2,2,3,,1,5,3,5,2,,3,3,5,1,,2,3,5,2,,3,4,3,2,3,,4,,4,,4,,4,,3,,
1.1467E+11,432305548,2024-08-26 22:19:03,2024-08-26 22:59:05,2.30.133.146,,,,,1,2,4,2006,2,5,4,4,5,3,4,3,too similar sounds,5,3,2,2,,5,3,1,1,,1,2,2,3,4,didn't like any of them,3,1,3,5,,2,1,3,4,,3,4,2,2,3,,5,3,1,3,,4,1,1,3,,1,2,5,4,3,,5,5,2,3,,1,5,1,3,,3,1,4,3,1,,2,5,3,2,,2,4,3,1,,5,1,3,5,1,,3,3,5,2,,2,3,5,2,,1,2,3,4,1,,4,3,5,2,,2,3,5,2,,5,2,5,3,3,,2,5,3,2,,2,5,3,2,,4,4,1,3,1,,4,1,3,1,,4,2,3,1,,1,2,2,4,3,,3,1,5,3,,1,1,4,3,,1,4,4,2,3,,5,4,1,3,,5,3,3,3,,1,4,3,5,2,,2,3,5,2,,2,3,4,2,,4,4,2,3,4,music was ass,2,,4,,5,,5,,4,,
1.1467E+11,432305548,2024-08-26 22:12:56,2024-08-26 22:47:29,72.201.18.236,,,,,1,2,5,1969,1,4,4,4,4,3,1,1,,4,3,1,1,,4,3,2,2,,2,2,2,3,4,,4,2,3,4,,1,2,3,4,,4,5,2,1,3,,5,2,1,3,,4,1,2,3,,2,2,5,1,3,,5,5,1,3,,1,4,2,3,,4,2,5,3,1,,2,5,3,1,,2,2,3,1,,4,2,3,4,1,,1,3,4,1,,2,3,5,1,,2,2,3,5,1,,3,3,4,1,,1,3,1,1,,4,1,5,3,2,,1,4,3,1,,1,3,3,1,,5,5,2,3,1,,5,2,3,1,,3,1,3,2,,1,3,1,4,3,,3,1,4,3,,2,1,3,3,,2,4,2,2,3,,5,3,1,3,,3,1,1,3,,1,4,3,4,1,,4,3,4,2,,1,3,5,2,,4,4,2,2,4,,4,Dancer with tamborine in the link does not show correct image.,2,,4,,4,,4,,
1.1467E+11,432305548,2024-08-26 21:55:32,2024-08-26 22:44:35,31.52.111.43,,,,,1,2,6,1974,2,5,4,3,4,1,2,2,,5,1,2,1,Need but faster music to go with the ballet,4,2,2,2,,1,4,2,3,5,,4,1,3,5,,2,1,2,5,,4,4,2,2,3,,5,4,2,3,,5,2,1,3,,2,3,5,4,3,,4,5,1,3,,1,5,1,3,,3,3,4,3,1,,2,4,3,2,,3,4,3,2,,4,1,3,4,1,,2,3,5,1,,2,3,4,1,,2,2,3,4,1,,2,3,4,2,,2,3,4,1,,4,2,5,3,2,,1,5,3,1,,3,5,3,2,,5,4,2,3,2,,4,2,3,2,,4,2,3,2,,3,2,1,5,3,,4,2,5,3,,2,1,4,3,,3,5,2,1,3,,5,5,1,3,,5,2,1,3,,2,2,3,4,5,,2,3,4,1,,2,3,4,1,,4,4,3,2,5,,4,,4,,4,,3,,5,,
1.1467E+11,432305548,2024-08-26 21:55:25,2024-08-26 22:43:46,5.64.199.172,,,,,1,2,7,1986,1,3,3,3,5,3,1,2,,4,3,4,1,,5,3,1,1,,1,1,1,3,4,,1,1,3,4,,1,1,3,4,,4,5,3,2,3,,5,4,2,3,,5,2,2,3,,3,2,5,2,3,,5,5,2,3,,2,5,2,3,,3,3,5,3,2,,5,5,3,2,,2,5,3,2,,5,2,3,5,2,,4,3,5,2,,2,3,5,2,,2,2,3,5,2,,3,3,5,1,,2,3,4,1,,4,1,5,3,2,,2,5,3,3,,1,5,3,2,,5,5,1,3,2,,5,2,3,2,,5,2,3,1,,2,2,2,4,3,,4,2,4,3,,1,1,4,3,,2,5,1,2,3,,5,3,2,3,,5,3,1,3,,2,4,3,2,2,,4,3,5,2,,1,3,4,2,,4,4,4,3,4,,5,,5,,5,,5,It was much nicer when you weren't having to focus on choosing a music piece,4,,
1.1467E+11,432305548,2024-08-26 21:56:01,2024-08-26 22:37:49,80.4.230.99,,,,,1,2,8,1974,2,3,4,4,4,3,1,1,,3,1,1,1,,4,1,1,1,,2,1,2,3,4,,1,1,3,3,,1,1,3,4,,4,4,2,1,3,,4,3,1,3,,4,1,1,3,,3,3,4,3,3,,4,5,3,3,,1,4,1,3,,4,2,4,3,2,,1,4,3,3,,2,5,3,2,,5,2,3,4,1,,3,3,4,1,,1,3,5,1,,1,2,3,4,1,,2,3,4,3,,1,3,4,2,,4,2,4,3,2,,1,5,3,2,,2,5,3,2,,5,5,2,3,1,,5,2,3,1,,5,1,3,1,,1,2,2,5,3,,3,1,4,3,,2,2,5,3,,1,5,2,1,3,,5,3,1,3,,5,1,1,3,,2,1,3,5,1,,1,3,5,1,,1,3,5,1,,4,4,3,2,5,,2,,2,,4,,3,,5,,
1.1467E+11,432305548,2024-08-26 21:56:15,2024-08-26 22:33:12,86.181.36.149,,,,,1,2,9,1987,2,3,3,3,5,3,1,2,,5,3,1,1,,4,3,1,1,,3,2,2,3,5,,2,1,3,4,,2,2,3,4,,4,4,2,2,3,,4,2,1,3,,2,2,2,3,,2,3,4,1,3,,3,4,2,3,,2,4,1,3,,5,2,4,3,1,,1,5,3,3,,2,4,3,2,,5,3,3,5,2,,2,3,5,1,,2,3,5,2,,3,1,3,4,1,,3,3,5,1,,2,3,4,1,,3,2,5,3,1,,1,5,3,2,,2,5,3,1,,4,4,2,3,2,,4,2,3,2,,4,1,3,2,,4,1,1,4,3,,3,5,4,3,,1,1,5,3,,3,3,1,1,3,,5,3,1,3,,4,2,1,3,,1,2,3,4,2,,3,3,4,2,,2,3,4,1,,3,2,4,2,3,,4,,5,,4,,5,,3,,
1.1467E+11,432305548,2024-08-26 21:56:08,2024-08-26 22:32:55,51.191.156.105,,,,,1,2,10,2001,2,3,3,4,4,3,1,3,,4,3,1,1,,4,3,1,1,,3,3,1,3,5,,2,1,3,5,,2,1,3,5,,4,5,1,2,3,,5,2,2,3,,5,1,1,3,,3,3,5,1,3,,4,5,2,3,,1,5,1,3,,4,2,5,3,2,,1,5,3,1,,1,5,3,1,,5,1,3,4,1,,1,3,5,1,,2,3,5,2,,3,2,3,5,1,,2,3,4,1,,2,3,5,1,,4,1,4,3,1,,2,4,3,2,,1,4,3,1,,4,4,1,3,1,,5,2,3,1,,5,2,3,1,,2,2,1,5,3,,4,1,5,3,,2,2,5,3,,4,5,2,1,3,,5,3,1,3,,4,1,1,3,,2,1,3,4,2,,2,3,4,1,,1,3,4,2,,4,4,2,3,2,,3,,4,,5,,4,,4,,
1.1467E+11,432305548,2024-08-26 20:06:53,2024-08-26 21:57:42,2.99.36.240,,,,,1,2,11,2000,1,3,4,3,2,3,1,1,I didn't feel that any of the 3 music files really harmonised with the artwork in my opinion,4,3,1,1,,4,3,2,2,"I didn't really feel that any of the sounds represented the artwork at all, nor were they particularly pleasing to the ear.",3,4,2,3,4,I did not like the drum sounds in relation to this artwork.,2,2,3,2,,2,2,3,4,"Overall, I enjoyed the music except for the drums. I felt they didn't fit.",5,3,1,1,3,I really enjoyed the Sound A music but didn't feel it matched the energy of the artwork. I felt the music had much more energy than the painting.,5,1,1,3,,5,1,1,3,,1,4,5,1,3,,4,4,2,3,,3,5,1,3,,3,2,5,3,2,Would be better without drums.,1,4,3,1,,2,4,3,2,,5,2,3,4,1,,2,3,5,1,,2,3,4,2,,2,1,3,5,2,,2,3,5,1,,1,3,4,1,,4,2,4,3,2,,1,4,3,2,,2,5,3,2,,5,4,2,3,1,,5,3,3,1,,5,1,3,1,,2,3,2,5,3,,5,2,5,3,,1,1,5,3,,3,2,1,2,3,,4,3,2,3,,4,1,2,3,,3,2,3,4,1,,1,3,5,1,,1,3,5,1,,3,4,3,2,4,,5,,5,,4,,5,,4,,
1.1467E+11,432305548,2024-08-26 20:08:21,2024-08-26 21:20:17,82.46.131.162,,,,,1,2,12,1990,1,4,4,4,2,3,1,1,"While Sound A was the most pleasing, I think the heavy drums felt out of place in concert with the painting. Sounds C and D were really unpleasant to listen to because they were so off beat.",4,3,1,1,,4,3,1,1,,2,2,1,3,4,"Sound A would have made sense with the painting and been a better piece overall without the percussion which threw it off and seemed again too aggressive. Sound B was rhythmically all over the place and too fast-paced for the painting.  Sound D was the nicest to listen to and the one that felt most in tune with the painting - although, and this may just be personal preference, but the drums ruined it.",2,1,3,5,,2,1,3,4,,4,4,1,1,3,"Sound A felt most in tune with the painting, with the pacing. Sound B was too off beat to enjoy. Sound C was rhythmically unpleasant. Again the MIDI drums spoiled my enjoyment of all pieces.",4,2,1,3,,4,2,1,3,,1,2,3,1,3,"Sound A was a little disjointed but rhythmically suited the painting better. I thought Sound B was the most pleasant to listen to, although perhaps a little too fast for this painting. Sound C was too disjointed to enjoy.",4,4,1,3,,1,4,1,3,,3,1,4,3,1,Both Sound A and B were slightly too fast for my perception of the painting although B was more enjoyable to listen to. Sound D was too disjointed to enjoy.,2,4,3,1,,2,4,3,1,,5,3,3,5,1,Sounds A and B were both good but B was more pleasant to listen to and more accurately reflected the mood of the painting. Sound D was rhythmically and tonally unpleasant.,3,3,5,1,,1,3,5,1,,2,2,3,4,1,,4,3,5,1,"Sound A was ok, but Sound C made more sense in terms of the rhythm and the dynamism of the painting. Sound D was an unpleasant sound and rhythmically bizarre.",1,3,4,1,,4,1,4,3,1,"Sound A was very strange rhythmically and tonally. Sound B was a great match for the rhythm and brightness of the painting. Sound D, like A, was too disjointed.",1,5,3,2,,1,4,3,1,,5,5,3,3,1,Sound A was pleasant to listen to and fit the rhythm of the painting - while the lower tones reflected some of the darker tones in the painting. Sound B and Sound D were disjointed.,5,2,3,1,,5,1,3,1,,1,2,1,4,3,Sound D was too disjointed. Sound A was sonically quite boring. Sound C was reflective and felt more in tune with the painting.,3,1,5,3,,1,1,4,3,,2,4,1,1,3,,4,2,1,3,Sound A fit the painting - some of its more melancholy minor keys reflected the despondent elements of the image. So far I feel this has been the best match to any painting. Sound B was too offbeat and out of key to enjoy as was Sound C.,5,1,1,3,,2,3,3,3,1,Sound A was too offbeat to enjoy as was Sound D. Sound C was the best overall but still not a great fit.,1,3,4,1,,2,3,4,1,,5,5,3,3,5,,3,,3,,5,,3,,5,,
1.1467E+11,432305548,2024-08-26 20:18:34,2024-08-26 21:12:05,216.39.227.86,,,,,1,2,13,2000,2,5,4,3,4,3,2,2,,4,3,2,1,,4,3,2,1,,2,4,2,3,5,,4,1,3,4,,1,1,3,4,,3,4,2,1,3,,4,2,2,3,,5,2,2,3,,2,4,5,1,3,,3,4,2,3,,2,5,2,3,,4,1,4,3,1,,1,5,3,2,,3,5,3,1,,4,2,3,4,2,,2,3,4,2,,2,3,5,1,,2,4,3,4,2,,2,3,4,2,,2,3,4,1,,4,1,5,3,2,,2,5,3,2,,2,5,3,1,,4,4,1,3,1,,4,2,3,1,,5,2,3,1,,1,2,1,5,3,,4,2,5,3,,2,1,5,3,,3,5,2,1,3,,4,3,2,3,,5,2,1,3,,2,2,3,5,1,,2,3,4,2,,1,3,5,1,,5,4,4,3,4,,2,,5,,4,,4,,4,,
